{
  "id": "npm-test/master",
  "source": {
    "remote": {
      "branch": "master",
      "repository": "https://github.com/ffalt/mah.git",
      "checkout_path": "./data/npm-test/build"
    }
  },
  "build": {
    "npm": {
      "cmd_name": "build:deploy-root",
      "folder_names": [
        "dist"
      ]
    }
  },
  "publish": {
    "folder": {
      "path": "./data/npm-test/site"
    },
    "archive": {
      "path": "./data/npm-test/archives"
    },
    "branch": {
      "branch": "releases"
    }
  }
}
